task_id,title,Descr,status,posting_date,deadline_date,Address,note,Employee_id,category_id,payments_id,reviews_id,country,city,price_range,price
290,Appliance Installation Assistance,"Assist clients with the installation of electrical appliances such as ceiling fans, light fixtures, ovens, and HVAC systems",pending,2020-04-10T19:05:25-02:04,2021-11-15T12:59:35-01:00,"07 Gamal Abdel Nasser Street, Port Said, Port Said",Protect federal street wide toward.,22,12,770,290,Egypt,Port Said,708-8644,380.0
291,Custom Software Development,"Design, code, test, and deploy software applications for various platforms, including desktop, web, and mobile, using programming languages such as Python, Java, and C++",open,2023-01-17T20:25:31-00:01,2021-06-12T13:21:49-01:03,"77 Gezira Street, Arish, North Sinai",Experience summer wrong design should the yard.,59,28,965,291,Egypt,Arish,947-3278,930.0
292,Generative AI Solutions,"Implement generative AI systems that can autonomously create art, music, stories, and designs in various styles, genres, and formats, mimicking human creativity and imagination.",done,2021-12-03T02:57:43-03:04,2021-02-09T15:34:07-03:09,"21 El Thawra Street, Bani Mazar, Minya",War focus people current view worker.,21,30,548,292,Egypt,Bani Mazar,803-9416,660.0
293,Web Application Development,"Create dynamic and interactive web applications for clients in diverse industries, incorporating user-friendly interfaces, responsive design, and scalable architecture",done,2023-12-27T08:08:43-00:01,2022-04-04T00:20:41-09:09,"59 El Nasr Street, Giza, Giza",Travel push agency design grow.,64,28,343,293,Egypt,Giza,721-3839,525.0
294,Abstract Canvas Painting,"Customize abstract paintings according to client preferences, size requirements, and color schemes.",done,2023-03-08T11:10:12-07:01,2023-10-28T10:03:20-04:05,"84 Lebanon Street, Arish, North Sinai",Wonder positive turn fight school hotel spring.,54,3,975,294,Egypt,Arish,070-1237,835.0
295,SEO Optimization Services,"Conduct keyword research, competitor analysis, and site audits to identify SEO opportunities, gaps, and areas for improvement.",done,2024-03-04T18:36:24-06:01,2023-07-31T13:22:43-07:09,"62 El Thawra Street, Cairo, Cairo",Education Mrs main work certainly.,100,32,630,295,Egypt,Cairo,144-5863,820.0
296,Responsive Website Redesign,"Redesign existing websites to be mobile-responsive, ensuring optimal viewing and interaction experiences across all devices and screen sizes",open,2021-10-01T00:55:02-00:06,2022-01-23T07:49:52-05:06,"56 July 26th Street, Zagazig, Sharqia",Different let each fight most recognize.,97,31,167,296,Egypt,Zagazig,886-5217,765.0
297,Storyboard Development,"Create sketches, thumbnails, and animatics to storyboard key scenes, camera angles, and character actions for animation projects",pending,2020-08-04T19:29:25-02:09,2020-03-01T02:36:03-09:07,"88 October Street, Esna, Luxor",Subject watch deal thousand respond top.,56,58,327,297,Egypt,Esna,729-9468,755.0
298,UI/UX Optimization,"Conduct usability testing, user research, and A/B testing to gather feedback and iteratively improve website navigation, layout, and interaction flows",done,2020-01-20T01:23:57-08:07,2022-04-15T07:34:37-04:04,"49 El Kornish Street, Ibsheway, Faiyum",Identify past woman enter professional bank.,76,31,486,298,Egypt,Ibsheway,928-0087,255.0
299,Wiring Upgrade Service,"Upgrade outdated wiring systems in residential and commercial properties to improve safety, efficiency, and compliance with electrical codes",open,2022-06-09T17:48:00-01:04,2021-06-28T19:17:51-07:09,"66 El Nasr Street, Rafah, North Sinai",Stock trouble none employee summer morning.,54,12,773,299,Egypt,Rafah,004-1613,300.0
300,Content Creation Services,"Offer high-quality content creation services for businesses, brands, and individuals across various formats and channels, including website content, blog posts, articles, social media posts, videos, infographics, and podcasts.",pending,2022-05-26T04:54:26-01:03,2020-02-13T12:16:46-06:03,"95 Al Nahda Street, Aswan, Aswan",Year all game.,45,18,645,300,Egypt,Aswan,555-9732,265.0
301,Deep Cleaning Service,"Remove dirt, dust, grime, and stains from hard-to-reach areas using specialized cleaning equipment.",pending,2024-01-14T17:37:43-06:08,2020-03-19T21:35:30-01:08,"91 El Nasr Street, Minya, Minya",Sister onto ever green lot democratic.,5,4,602,301,Egypt,Minya,690-1365,380.0
302,Abstract Canvas Painting,"Express emotions and ideas through bold brushstrokes, vibrant colors, and dynamic compositions.",done,2024-04-21T12:21:36-01:07,2020-02-16T22:38:55-06:08,"82 El Gaish Street, Fayed, Ismailia",Police draw best prevent upon development.,21,3,532,302,Egypt,Fayed,165-1924,845.0
303,Visual Effects Compositing,"Composite visual effects elements such as CG renders, green screen footage, and particle simulations into live-action footage to create seamless and immersive visual effects sequences",pending,2020-05-15T07:55:49-01:07,2023-11-15T08:28:28-06:02,"39 Ahmed Orabi Street, Minya, Minya",School inside force most region.,49,58,698,303,Egypt,Minya,229-8130,45.0
304,Financial Planning Consultation,"Provide expert advice and recommendations on various financial topics, such as budgeting, saving, debt management, tax planning, insurance coverage, and estate planning, to help clients make informed decisions and optimize their financial outcomes.",done,2020-11-29T04:02:14-07:05,2023-11-05T06:49:27-04:04,"80 Al Nile Street, Sohag, Asyut",Brother carry hope.,45,38,848,304,Egypt,Sohag,816-7748,995.0
305,Language Lessons,Offer personalized language lessons and tutoring sessions for individuals and small groups seeking to improve their language skills,open,2020-09-10T21:46:16-00:02,2020-10-15T06:02:23-07:02,"84 El Kornish Street, Hurghada, Red Sea",Owner time again situation.,10,54,920,305,Egypt,Hurghada,879-2203,200.0
306,Legal Writing and Documentation Services,"Offer professional legal writing and documentation services for law firms, businesses, and individuals, including contracts, agreements, legal briefs, memos, opinions, and court documents.",cancelled,2022-06-19T06:14:08-06:04,2024-06-05T10:48:02-04:03,"03 July 26th Street, Dahab, South Sinai",Management discover today language.,51,29,343,306,Egypt,Dahab,513-6412,155.0
307,Kitchen Plumbing Installation,Replace old and faulty kitchen plumbing components with new ones to prevent leaks and water damage.,done,2020-01-05T15:56:50-08:04,2023-03-22T07:44:24-04:09,"26 El Haram Street, Abu Kebir, Sharqia",Art system fill attack institution.,3,2,120,307,Egypt,Abu Kebir,794-3002,630.0
308,Blockchain Development Services,"Offer blockchain maintenance and support services, including node management, network monitoring, security audits, and protocol upgrades, to ensure the stability, performance, and resilience of blockchain ecosystems.",cancelled,2022-01-10T18:46:38-07:00,2022-11-05T14:44:25-05:06,"23 El Gaish Street, Aswan, Aswan",Most interview know our.,2,20,855,308,Egypt,Aswan,468-6154,900.0
309,Landscape Design and Installation,"Collaborate with clients to conceptualize and create custom landscape designs that reflect their preferences, lifestyle, and budget.",cancelled,2022-02-03T19:30:36-02:08,2022-08-25T03:30:51-05:00,"51 Al Ahram Street, Borg El Arab, Alexandria",Even approach institution really.,54,14,895,309,Egypt,Borg El Arab,875-0860,505.0
310,Cross-Browser Compatibility Testing,"Conduct cross-browser compatibility testing to ensure website functionality and performance consistency across different web browsers such as Chrome, Firefox, Safari, and Edge",open,2022-08-26T16:32:38-08:00,2020-05-20T09:44:26-09:08,"63  El Obour Street, Kom Ombo, Aswan",Nearly PM him able reduce protect.,68,31,763,310,Egypt,Kom Ombo,765-8067,625.0
311,Blockchain Development Services,"Integrate blockchain technology with existing systems, platforms, and processes to enable features such as immutability, transparency, traceability, and trustlessness.",cancelled,2022-09-12T18:30:54-09:09,2022-02-24T05:58:08-04:03,"29 Gamal Abdel Nasser Street, Tal El Kabir, Ismailia",Like particularly compare coach.,81,20,895,311,Egypt,Tal El Kabir,097-1524,65.0
312,Deep Cleaning Service,Offer comprehensive deep cleaning services for residential and commercial properties.,done,2020-01-10T06:58:57-06:00,2020-02-08T10:21:29-06:03,"39 Gamal Abdel Nasser Street, Faraskur, Damietta",Education office also describe.,10,4,994,312,Egypt,Faraskur,863-9411,230.0
313,Data Entry and Analysis Services,"Offer accurate and efficient data entry services for businesses, organizations, and individuals, ensuring timely and error-free input of data into digital databases, spreadsheets, or other software applications.",open,2023-05-09T16:36:30-07:00,2021-09-27T03:25:36-00:06,"97 October Street, Al-Wasta, Beni Suef",Pressure none some difference way fast happen.,100,15,116,313,Egypt,Al-Wasta,524-3630,970.0
314,International Shipping Solutions,Ensure compliance with international shipping regulations and standards to facilitate smooth and hassle-free delivery.,open,2020-03-17T14:48:01-06:00,2020-03-02T14:58:52-09:00,"90  El Obour Street, El-Qoseir, Red Sea",Make expert thank. Speech never trade investment.,2,7,639,314,Egypt,El-Qoseir,584-1010,105.0
315,Instructional Design Consulting,Collaborate with stakeholders to design effective and engaging online learning experiences,open,2023-01-24T14:43:37-07:08,2021-08-05T14:23:58-00:07,"87 Ahmed Orabi Street, Bani Mazar, Minya",Drop call take understand up church.,62,82,951,315,Egypt,Bani Mazar,618-7347,180.0
316,Interactive Learning Modules,"Design interactive learning modules and multimedia presentations to enhance student engagement, comprehension, and retention",done,2022-09-14T18:18:03-09:04,2022-05-04T17:26:04-06:03,"60 Salah Salem Street, Farafra, New Valley",Left letter job base job.,4,82,866,316,Egypt,Farafra,263-9407,805.0
317,Data Entry and Analysis Services,"Utilize data visualization tools and techniques to present findings in clear and compelling formats, such as charts, graphs, dashboards, and reports.",done,2020-02-10T15:53:20-07:08,2024-06-12T00:54:01-03:04,"69 Al Ahram Street, Asyut, Asyut",Design protect Democrat program half walk.,33,15,951,317,Egypt,Asyut,958-3053,220.0
318,Content Creation Services,"Offer high-quality content creation services for businesses, brands, and individuals across various formats and channels, including website content, blog posts, articles, social media posts, videos, infographics, and podcasts.",open,2021-05-06T08:07:47-03:08,2020-07-19T02:55:32-01:06,"94 El Nasr Street, Shibin El Kom, Monufia",Trip our get century should.,34,18,406,318,Egypt,Shibin El Kom,515-2932,890.0
319,Tax Planning and Preparation,"Provide comprehensive tax planning and preparation services for individuals, businesses, and organizations to minimize tax liabilities, maximize deductions, and ensure compliance with tax laws and regulations",open,2020-07-31T20:39:53-01:04,2020-07-20T13:25:40-06:04,"36 El Gaish Street, Kharga, New Valley",Best true food age parent describe.,87,37,703,319,Egypt,Kharga,796-0538,385.0
320,Motion Graphics Design,"Design dynamic motion graphics and visual effects for multimedia projects, including title sequences, logo animations, and promotional videos",cancelled,2024-01-13T22:49:29-09:08,2024-01-11T12:00:17-08:09,"17 El Nozha Street, Sohag, Sohag",Agreement at thousand language.,36,58,685,320,Egypt,Sohag,917-9997,955.0
321,Kitchen Plumbing Installation,Connect water supply lines and drainage pipes to ensure proper functioning of kitchen plumbing systems.,open,2022-03-26T21:21:15-09:08,2022-04-23T03:21:37-04:05,"03 Lebanon Street, Faiyum, Faiyum",Card something author foot notice customer.,10,2,263,321,Egypt,Faiyum,503-1687,5.0
322,Assessment and Feedback Systems,"Develop assessment tools and feedback mechanisms to evaluate student learning outcomes, track progress, and provide timely feedback",cancelled,2023-12-22T06:36:38-09:04,2023-10-15T23:10:16-00:08,"60 Salah Salem Street, Esna, Luxor",Everybody full away body.,39,82,583,322,Egypt,Esna,838-7793,445.0
323,Multilingual Course Development,"Translate course content, subtitles, and instructions into multiple languages to facilitate accessibility and inclusivity",cancelled,2021-03-28T12:56:01-01:05,2022-12-31T15:57:54-01:07,"91 Lebanon Street, Beni Suef, Beni Suef",Half majority he fact voice loss PM.,61,82,859,323,Egypt,Beni Suef,150-2805,875.0
324,Express Delivery Service,"Provide fast and efficient express delivery services for packages, parcels, and documents.",open,2021-08-12T07:02:39-05:00,2021-12-14T03:31:25-01:06,"72 Ahmed Orabi Street, Siwa, Matrouh",Road trip thing knowledge carry blood value.,100,6,995,324,Egypt,Siwa,420-1725,715.0
325,Emergency Electrical Repairs,"Diagnose and repair faulty wiring, overloaded circuits, and electrical hazards promptly to restore power and ensure safety",cancelled,2024-02-05T02:04:06-03:01,2023-09-01T21:01:22-07:02,"33 July 26th Street, Kharga, New Valley",Agree agent wrong security.,42,12,967,325,Egypt,Kharga,775-6433,815.0
326,SEO-Friendly Design Strategies,"Implement SEO best practices and strategies into web design projects to improve search engine visibility, organic traffic, and ranking performance",done,2022-05-21T07:59:45-01:07,2023-08-05T19:03:27-06:09,"74 El Galaa Street, Giza, Cairo",Boy conference move drive eye walk.,49,31,231,326,Egypt,Giza,238-5689,580.0
327,3D Animation Production,"Create realistic characters, environments, and visual effects using 3D modeling, rigging, animation, and rendering software such as Autodesk Maya, Blender, or Cinema 4D",open,2023-05-04T05:41:25-05:05,2022-11-22T08:28:41-01:08,"60 Al-Azhar Street, Kafr El Sheikh, Kafr El Sheikh",Conference majority wish source case well.,25,58,168,327,Egypt,Kafr El Sheikh,160-2870,990.0
328,Mobile App Prototyping,"Create interactive prototypes using tools like Adobe XD, Sketch, or Figma to visualize app features and gather feedback from stakeholders",done,2020-04-28T10:38:59-09:04,2023-02-08T02:54:08-06:09,"09 October Street, Suez, Suez",Second effort woman car tax dream the.,66,28,216,328,Egypt,Suez,411-5857,775.0
329,Appliance Installation Assistance,"Ensure proper wiring, grounding, and connection of appliances to prevent electrical problems and ensure optimal performance",cancelled,2024-05-02T22:11:50-05:02,2022-03-06T04:23:34-05:01,"50 El Nozha Street, Sers El-Lyan, Monufia",Whether far old learn.,55,12,408,329,Egypt,Sers El-Lyan,567-7812,875.0
330,Cultural Exchange Programs,"Organize cultural exchange programs and language immersion experiences for students to learn about different cultures, traditions, and customs while practicing language skills in authentic settings",open,2022-02-04T04:25:13-02:00,2022-06-17T03:14:28-00:06,"41  El Obour Street, Port Fuad, Port Said",Television kid of will other feeling represent.,10,54,135,330,Egypt,Port Fuad,569-0338,490.0
331,Social Media Marketing Campaign,"Provide strategic recommendations and insights based on social media data analysis, industry trends, and competitive benchmarks to guide decision-making and achieve marketing objectives.",open,2022-03-03T00:12:57-02:01,2021-05-26T19:54:39-00:04,"74 Ahmed Orabi Street, Banha, Qalyubia",Change black red role team. Cost one short.,31,33,921,331,Egypt,Banha,110-0329,895.0
332,Management Consulting Services,"Offer management consulting services to help businesses optimize financial performance, streamline operations, and achieve strategic objectives",open,2020-12-10T05:23:36-05:06,2021-08-04T11:24:22-02:04,"47 Ahmed Orabi Street, Bir al-Abed, North Sinai",Despite leg religious material book seat.,11,37,773,332,Egypt,Bir al-Abed,251-0516,485.0
333,Bilingual Education Support,Assist bilingual students and multilingual learners in developing proficiency in their primary and secondary languages,pending,2020-10-25T14:01:15-01:06,2020-03-25T13:24:20-07:04,"53 Ahmed Orabi Street, Marsa Matruh, Matrouh",Source next admit court however. Him impact send.,66,54,587,333,Egypt,Marsa Matruh,608-6812,245.0
334,Responsive Website Redesign,"Redesign existing websites to be mobile-responsive, ensuring optimal viewing and interaction experiences across all devices and screen sizes",pending,2023-08-08T01:55:55-08:00,2023-01-05T12:38:13-06:00,"32 El Nozha Street, Kafr Abdou, Alexandria",Day get one job me role detail ok.,56,31,238,334,Egypt,Kafr Abdou,850-2560,305.0
335,Content Platform Integration,"Upload, organize, and manage course materials, assessments, and student interactions within the platform",done,2022-05-25T06:13:24-07:08,2022-03-14T10:46:02-04:01,"18 El Kornish Street, Arish, North Sinai",Edge assume imagine wait tree.,93,82,300,335,Egypt,Arish,634-8571,600.0
336,Assessment and Feedback Systems,"Develop assessment tools and feedback mechanisms to evaluate student learning outcomes, track progress, and provide timely feedback",pending,2021-10-30T21:11:49-06:01,2021-01-15T11:04:11-00:04,"47 El Nasr Street, Nag Hammadi, Qena",Go relate relate subject good beyond tree stock.,93,82,139,336,Egypt,Nag Hammadi,491-5898,655.0
337,Cross-Browser Compatibility Testing,"Conduct cross-browser compatibility testing to ensure website functionality and performance consistency across different web browsers such as Chrome, Firefox, Safari, and Edge",done,2021-01-03T01:22:24-03:08,2021-08-17T07:34:28-01:04,"72 Al Ahram Street, Alexandria, Alexandria",Unit always very another long.,46,31,274,337,Egypt,Alexandria,319-2175,205.0
338,Furniture Assembly Assistance,"Offer efficient and reliable furniture assembly assistance for residential and commercial clients, including IKEA furniture and other flat-pack items.",cancelled,2023-03-31T20:15:34-05:06,2020-07-23T17:20:16-05:05,"37 El Nozha Street, Dakhla, New Valley",Build establish state TV foreign notice.,42,13,574,338,Egypt,Dakhla,694-5001,10.0
339,UI/UX Optimization,"Optimize user interface (UI) and user experience (UX) design elements to enhance usability, accessibility, and engagement on web platforms",cancelled,2022-07-27T10:28:56-07:00,2020-11-21T09:56:05-01:01,"19 Salah Salem Street, Sohag, Sohag",Follow Congress success product full do.,51,31,692,339,Egypt,Sohag,150-8788,545.0
340,Market Research and Analysis,"Conduct comprehensive market research and analysis to gather data, insights, and intelligence on industry trends, consumer behavior, competitor strategies, and market dynamics.",open,2020-03-24T08:09:23-01:08,2022-01-31T04:43:45-01:02,"94 Talaat Harb Street, Arish, North Sinai",War campaign owner poor each.,88,19,180,340,Egypt,Arish,977-2446,850.0
341,Wiring Upgrade Service,"Upgrade outdated wiring systems in residential and commercial properties to improve safety, efficiency, and compliance with electrical codes",done,2020-10-20T00:45:40-06:05,2020-05-19T23:40:13-01:04,"65 Gamal Abdel Nasser Street, Shibin El Kom, Monufia",Well material room thousand white at story all.,70,12,321,341,Egypt,Shibin El Kom,040-5493,350.0
342,Content Platform Integration,"Upload, organize, and manage course materials, assessments, and student interactions within the platform",pending,2022-09-03T17:46:32-06:03,2021-08-04T19:50:01-00:02,"31 El Galaa Street, Farafra, New Valley",Leg them high window.,54,82,340,342,Egypt,Farafra,553-2781,380.0
343,Education Content Creation,"Develop engaging and informative educational content for online courses, tutorials, and learning resources",cancelled,2020-07-28T12:11:48-03:02,2020-10-29T05:48:47-06:01,"94 Al Nile Street, Zefta, Gharbia",Analysis key moment low not. Need plan perhaps.,25,82,810,343,Egypt,Zefta,162-9241,960.0
344,Financial Planning Consultation,"Provide expert advice and recommendations on various financial topics, such as budgeting, saving, debt management, tax planning, insurance coverage, and estate planning, to help clients make informed decisions and optimize their financial outcomes.",pending,2020-06-04T21:21:09-08:03,2023-01-10T22:28:04-00:08,"11 Al Nile Street, Talkha, Dakahlia",Line dog choice local exactly may from.,100,38,184,344,Egypt,Talkha,076-4186,690.0
345,Personalized Home Cooking,"Offer personalized home cooking services tailored to individual tastes, dietary preferences, and nutritional needs.",done,2020-11-28T22:18:56-05:04,2023-06-27T23:52:49-02:03,"94 Salah Salem Street, Sers El-Lyan, Monufia",Same test top line Republican project something.,89,9,487,345,Egypt,Sers El-Lyan,224-6339,365.0
346,Financial Statement Analysis,"Analyze financial statements such as balance sheets, income statements, and cash flow statements to evaluate the financial health, performance, and profitability of businesses",cancelled,2020-02-11T22:10:26-03:01,2020-01-03T23:19:28-08:05,"46 El Kornish Street, Ibsheway, Faiyum",Point school shoulder American spend.,40,37,330,346,Egypt,Ibsheway,839-4662,985.0
347,Market Research and Analysis,"Conduct comprehensive market research and analysis to gather data, insights, and intelligence on industry trends, consumer behavior, competitor strategies, and market dynamics.",open,2021-01-01T06:46:11-05:00,2021-10-24T18:50:07-09:01,"92 El Thawra Street, Shibin El Kom, Monufia",Cover catch follow last trial campaign.,6,19,152,347,Egypt,Shibin El Kom,413-5202,915.0
348,Tax Planning and Preparation,"Provide comprehensive tax planning and preparation services for individuals, businesses, and organizations to minimize tax liabilities, maximize deductions, and ensure compliance with tax laws and regulations",pending,2021-11-04T00:10:43-02:03,2020-06-16T01:58:46-00:01,"08 Al Nile Street, Ibsheway, Faiyum",Stand chair parent explain government bill floor.,22,37,912,348,Egypt,Ibsheway,850-9300,655.0
349,Local Moving Assistance,Assist clients with local moving projects by providing reliable and efficient transportation services.,done,2023-02-06T02:30:53-00:04,2020-08-07T00:07:44-03:01,"38 El Gaish Street, Talkha, Dakahlia",Machine opportunity two event develop.,85,5,802,349,Egypt,Talkha,437-2733,720.0
350,Furniture Assembly Assistance,"Assemble a wide range of furniture pieces such as beds, sofas, tables, chairs, desks and shelves.",done,2020-09-01T18:08:07-07:05,2021-01-06T05:45:40-01:08,"77 Gamal Abdel Nasser Street, Hurghada, Red Sea",Natural game moment child feel former.,82,13,380,350,Egypt,Hurghada,256-3065,135.0
351,Tax Planning and Preparation,"Provide comprehensive tax planning and preparation services for individuals, businesses, and organizations to minimize tax liabilities, maximize deductions, and ensure compliance with tax laws and regulations",pending,2020-02-24T04:44:51-03:09,2022-05-13T07:24:09-06:08,"20 Gamal Abdel Nasser Street, Cairo, Cairo",Admit feel last strong present discuss.,60,37,925,351,Egypt,Cairo,616-4012,910.0
352,Local Moving Assistance,"Offer additional moving services such as packing supplies, storage solutions, and furniture assembly.",pending,2023-01-23T12:15:28-05:02,2024-05-27T16:29:35-00:08,"06 Salah Salem Street, Giza, Cairo",Middle nor everybody should someone keep deal.,1,5,561,352,Egypt,Giza,546-0889,840.0
353,Bilingual Education Support,Assist bilingual students and multilingual learners in developing proficiency in their primary and secondary languages,done,2023-04-22T09:55:18-07:01,2020-11-27T15:41:42-08:08,"93 July 26th Street, Fayed, Ismailia",Somebody suggest approach.,67,54,192,353,Egypt,Fayed,880-3769,605.0
354,Management Consulting Services,"Offer management consulting services to help businesses optimize financial performance, streamline operations, and achieve strategic objectives",done,2021-01-05T00:08:18-08:06,2021-10-19T16:42:17-06:01,"33 Salah Salem Street, Zagazig, Sharqia",Skill determine feel mind.,48,37,985,354,Egypt,Zagazig,697-3145,830.0
355,Express Delivery Service,Ensure prompt pickup and delivery of items within designated timeframes and locations.,cancelled,2022-04-29T03:32:35-02:07,2021-04-29T17:05:50-06:02,"23 Al Nile Street, Abnub, Asyut",Even Mrs off animal.,93,6,655,355,Egypt,Abnub,098-8371,990.0
356,Tax Planning and Preparation,"Provide comprehensive tax planning and preparation services for individuals, businesses, and organizations to minimize tax liabilities, maximize deductions, and ensure compliance with tax laws and regulations",cancelled,2020-10-20T17:00:06-08:08,2020-12-16T14:18:17-08:05,"71 Al-Azhar Street, Ataqah, Suez",Home fast talk project you risk court.,54,37,379,356,Egypt,Ataqah,507-1187,715.0
357,3D Animation Production,"Create realistic characters, environments, and visual effects using 3D modeling, rigging, animation, and rendering software such as Autodesk Maya, Blender, or Cinema 4D",cancelled,2020-07-31T22:04:54-04:09,2022-10-24T20:35:54-08:03,"62 Abu Bakr El Seddik Street, Minya, Minya",Agent probably military. Yeah need here loss.,78,58,947,357,Egypt,Minya,198-7864,285.0
358,Instructional Design Consulting,"Provide instructional design consulting services to educators, trainers, and content creators, offering expertise in pedagogy, learning theories, instructional strategies, and technology integration",cancelled,2021-07-27T15:10:12-05:06,2023-12-26T16:51:45-06:03,"79 Al Nahda Street, Dar El Salam, Sohag",Join treatment rich.,39,82,304,358,Egypt,Dar El Salam,547-9078,730.0
359,Appliance Installation Assistance,"Ensure proper wiring, grounding, and connection of appliances to prevent electrical problems and ensure optimal performance",done,2024-03-12T08:25:42-02:08,2020-09-07T01:38:09-05:05,"38 Gezira Street, Luxor, Qena",Five sell present area.,82,12,648,359,Egypt,Luxor,798-8261,130.0
360,Wooden Furniture Restoration,Restore antique wooden furniture to its former glory using traditional techniques and modern tools.,open,2022-07-14T05:48:50-04:03,2023-08-17T02:40:53-00:09,"01 Ahmed Orabi Street, Kafr El-Zayat, Gharbia",Require owner final sometimes debate.,87,1,125,360,Egypt,Kafr El-Zayat,819-5867,5.0
