task_id,title,Descr,status,posting_date,deadline_date,Address,note,Employee_id,category_id,payments_id,reviews_id,country,city,price_range,price
217,Management Consulting Services,"Provide expert advice and recommendations on budgeting, forecasting, cost analysis, and profitability improvement strategies",pending,2023-01-23T21:46:10-08:02,2024-03-06T02:30:07-08:04,"76 Abu Bakr El Seddik Street, Kafr El-Zayat, Gharbia",Heart American must school charge add heavy.,92,37,985,217,Egypt,Kafr El-Zayat,539-4000,185.0
218,Responsive Website Redesign,"Implement fluid layouts, flexible images, and media queries to adapt content dynamically based on device characteristics",pending,2021-05-22T05:19:18-09:01,2023-07-28T23:31:51-08:07,"46  El Obour Street, Nuweiba, South Sinai",Debate between firm.,65,31,543,218,Egypt,Nuweiba,648-8414,895.0
219,Appliance Installation Assistance,"Ensure proper wiring, grounding, and connection of appliances to prevent electrical problems and ensure optimal performance",cancelled,2021-04-27T07:23:07-09:08,2020-05-17T07:11:44-04:05,"09 Ahmed Orabi Street, Zagazig, Sharqia",Occur participant each ability.,8,12,458,219,Egypt,Zagazig,538-5822,975.0
220,Electrical Troubleshooting Services,Provide professional recommendations and solutions for preventing future electrical problems and improving overall electrical efficiency.,done,2021-09-03T01:52:22-03:08,2021-04-20T08:48:17-04:03,"39 July 26th Street, Hurghada, Red Sea",Defense kind find western war.,50,12,734,220,Egypt,Hurghada,994-0817,200.0
221,Financial Statement Analysis,"Identify trends, variances, and key financial metrics to support decision-making, forecasting, and strategic planning",done,2024-05-03T21:17:48-01:02,2021-04-29T12:27:08-08:00,"88 El Gaish Street, Arish, North Sinai",Generation sense voice to.,100,37,669,221,Egypt,Arish,556-0523,180.0
222,Management Consulting Services,"Provide expert advice and recommendations on budgeting, forecasting, cost analysis, and profitability improvement strategies",open,2023-05-05T17:13:16-04:00,2020-04-02T04:32:46-00:09,"23 El Gaish Street, Maghagha, Minya",Until quite senior run. Mr sort and couple.,54,37,771,222,Egypt,Maghagha,133-5840,545.0
223,Character Animation Rigging,"Rig and animate characters for 2D and 3D animation projects, including bipedal and quadrupedal characters, creatures, and mechanical objects",open,2024-04-22T22:25:38-05:04,2022-03-18T02:45:15-05:07,"07 Al Ahram Street, Zefta, Gharbia",Sit product military book that.,73,58,436,223,Egypt,Zefta,306-3696,85.0
224,Motion Graphics Design,"Utilize motion design principles, typography, and animation techniques to convey information and captivate audiences",done,2024-02-19T00:22:33-07:05,2021-06-04T18:04:57-01:07,"71 July 26th Street, Farafra, New Valley",Reach back third hold.,19,58,882,224,Egypt,Farafra,718-3971,785.0
225,Motion Graphics Design,"Design dynamic motion graphics and visual effects for multimedia projects, including title sequences, logo animations, and promotional videos",open,2023-09-29T19:10:03-07:04,2022-05-28T05:36:53-09:03,"15 El Nozha Street, Maghagha, Minya",True arm game while not.,61,58,341,225,Egypt,Maghagha,720-8221,585.0
226,Emergency Electrical Repairs,"Provide 24/7 emergency electrical repair services to address sudden power outages, electrical fires, and other urgent issues",done,2023-11-10T08:19:49-04:06,2020-05-30T08:47:18-07:03,"18 Abu Bakr El Seddik Street, Maghagha, Minya",Whom front year.,63,12,702,226,Egypt,Maghagha,078-2610,440.0
227,Storyboard Development,"Create sketches, thumbnails, and animatics to storyboard key scenes, camera angles, and character actions for animation projects",cancelled,2020-04-25T19:37:46-09:04,2022-06-06T16:29:13-03:09,"03 Gamal Abdel Nasser Street, Al-Wasta, Beni Suef",Be join name analysis.,70,58,741,227,Egypt,Al-Wasta,753-6723,925.0
228,Market Research and Analysis,"Stay informed about market developments, emerging trends, regulatory changes, and competitive threats through continuous monitoring, analysis, and synthesis of relevant information.",pending,2024-03-11T00:31:10-00:00,2022-10-15T23:17:54-02:02,"26  El Obour Street, Hurghada, Red Sea",These your include then child save.,96,19,824,228,Egypt,Hurghada,538-1066,910.0
229,Storyboard Development,"Create sketches, thumbnails, and animatics to storyboard key scenes, camera angles, and character actions for animation projects",cancelled,2020-09-06T14:37:58-06:05,2021-11-21T12:43:13-09:09,"10 Lebanon Street, Marsa Matruh, Matrouh",Guy staff who magazine inside drop yourself.,4,58,402,229,Egypt,Marsa Matruh,957-0915,390.0
230,Custom Software Development,Develop custom software solutions tailored to the unique needs and requirements of businesses and organizations,open,2023-11-12T13:04:59-09:08,2023-01-10T22:41:08-08:04,"56 Abu Bakr El Seddik Street, Hurghada, Red Sea",Born owner west establish open.,83,28,274,230,Egypt,Hurghada,551-3366,445.0
231,3D Animation Production,"Produce high-quality 3D animations for films, television, video games, and advertising campaigns",open,2022-10-20T17:10:11-03:00,2022-04-03T01:48:16-03:01,"14 Abu Bakr El Seddik Street, Ismailia, Ismailia",Standard friend common government with improve.,40,58,227,231,Egypt,Ismailia,435-8932,755.0
232,Custom Software Development,Develop custom software solutions tailored to the unique needs and requirements of businesses and organizations,open,2020-10-20T22:28:19-08:02,2021-02-15T18:18:45-01:08,"35 Al Nile Street, Talkha, Dakahlia",Focus strategy guess decision power.,36,28,413,232,Egypt,Talkha,529-2601,170.0
233,SEO Optimization Services,"Conduct keyword research, competitor analysis, and site audits to identify SEO opportunities, gaps, and areas for improvement.",open,2023-03-10T08:33:02-09:06,2021-01-31T17:03:48-06:04,"45 Salah Salem Street, Ismailia, Ismailia",Tv professional modern.,44,32,700,233,Egypt,Ismailia,285-7579,190.0
234,Storyboard Development,"Develop storyboards and animatics to visualize and plan animation sequences, shot compositions, and narrative flow",pending,2023-02-28T00:45:43-03:05,2023-06-25T07:49:43-05:00,"67 Al Nile Street, Hurghada, Red Sea",Far building right.,98,58,169,234,Egypt,Hurghada,643-7090,160.0
235,Financial Advisory Services,"Provide personalized financial advisory services to individuals and families, including investment advice, retirement planning, estate planning, and wealth management",open,2022-10-19T12:19:51-08:01,2020-03-13T21:34:22-08:07,"28 Talaat Harb Street, Dakhla, New Valley",Technology question media sell.,16,37,170,235,Egypt,Dakhla,121-8698,35.0
236,Content Platform Integration,"Upload, organize, and manage course materials, assessments, and student interactions within the platform",cancelled,2020-02-28T03:20:19-05:06,2023-07-08T23:31:29-07:08,"83 Al-Azhar Street, Aswan, Aswan",Top determine follow professor civil.,43,82,882,236,Egypt,Aswan,433-7834,340.0
237,Language Lessons,"Tailor lessons to students' proficiency levels, learning styles, and language goals, covering grammar, vocabulary, pronunciation, and conversation practice",pending,2022-03-25T20:54:10-04:01,2020-06-28T10:23:31-09:04,"32  El Obour Street, Luxor, Qena",Debate run foreign call either.,68,54,640,237,Egypt,Luxor,955-6255,625.0
238,Cultural Exchange Programs,"Organize cultural exchange programs and language immersion experiences for students to learn about different cultures, traditions, and customs while practicing language skills in authentic settings",cancelled,2024-04-23T16:40:59-08:08,2021-01-12T00:19:16-07:06,"69 El Haram Street, Al-Wasta, Beni Suef",Gas time style specific kind.,57,54,124,238,Egypt,Al-Wasta,227-1952,830.0
239,Landscape Design and Installation,"Offer professional landscape design and installation services to enhance outdoor spaces, including residential yards, commercial properties, and public areas.",pending,2022-11-16T03:53:26-00:05,2023-06-10T01:44:05-05:00,"94 El Haram Street, Armant, Luxor",Mission card all.,71,14,905,239,Egypt,Armant,893-4075,975.0
240,Storyboard Development,"Create sketches, thumbnails, and animatics to storyboard key scenes, camera angles, and character actions for animation projects",open,2023-08-12T14:56:46-06:09,2023-07-14T11:19:41-09:05,"07 El Nozha Street, Esna, Luxor",Through what job standard within.,51,58,376,240,Egypt,Esna,228-6534,260.0
241,electrical help,"Appliance Installation Assistance: Assist clients with the installation of electrical appliances such as ceiling fans, light fixtures, ovens, and HVAC systems. Ensure proper wiring, grounding, and connection of appliances to prevent electrical problems and ensure optimal performance.",pending,2023-12-12T05:35:58-07:08,2023-04-17T01:20:55-05:08,"25 Talaat Harb Street, Marsa Matruh, Matrouh",Thank yes fish my organization big since.,88,28,173,241,Egypt,Marsa Matruh,944-4893,935.0
242,Financial Advisory Services,"Provide personalized financial advisory services to individuals and families, including investment advice, retirement planning, estate planning, and wealth management",pending,2020-10-12T12:18:53-07:02,2020-01-26T23:24:01-04:07,"80 Al Nile Street, Borg El Arab, Alexandria",Agree others shake American.,95,37,150,242,Egypt,Borg El Arab,346-5785,840.0
243,Storyboard Development,"Create sketches, thumbnails, and animatics to storyboard key scenes, camera angles, and character actions for animation projects",cancelled,2022-09-08T07:13:25-09:00,2021-03-13T13:47:16-01:08,"47 El Haram Street, Beni Suef, Beni Suef",Mother tax finish through field finish.,1,58,140,243,Egypt,Beni Suef,364-8916,625.0
244,Wiring Upgrade Service,"Replace old wiring, circuit breakers, and outlets with modern, energy-efficient components",open,2021-10-05T06:15:43-07:04,2022-11-06T06:44:23-03:04,"11 El Nasr Street, Marsa Alam, Red Sea",Special answer growth factor.,2,12,256,244,Egypt,Marsa Alam,620-4809,990.0
245,Blockchain Development Services,"Design and develop custom blockchain solutions, including public and private networks, smart contracts, tokens, and decentralized applications (DApps), tailored to specific use cases and industry requirements.",done,2023-02-19T05:04:27-03:03,2022-06-28T05:25:31-09:02,"43 Al Nile Street, Kharga, New Valley",Message coach movie describe phone each real.,65,20,122,245,Egypt,Kharga,095-6592,960.0
246,Deep Cleaning Service,Provide customized deep cleaning solutions tailored to the specific needs and preferences of each client.,open,2022-02-12T16:36:05-05:05,2021-07-10T12:27:41-05:04,"32 Al Nile Street, Abnub, Asyut",Station behind statement no war.,61,4,227,246,Egypt,Abnub,610-9743,190.0
247,Express Delivery Service,Track and monitor delivery status in real-time to provide accurate updates to clients and recipients.,open,2022-04-10T13:11:19-06:07,2023-12-16T21:36:54-09:08,"57 Ahmed Orabi Street, Ashmoun, Monufia",Popular child team able soon several I.,58,6,744,247,Egypt,Ashmoun,308-4170,645.0
248,Mobile App Prototyping,"Create interactive prototypes using tools like Adobe XD, Sketch, or Figma to visualize app features and gather feedback from stakeholders",pending,2020-07-06T06:52:48-09:01,2023-06-03T13:47:26-00:02,"54 El Nasr Street, Abu Kebir, Sharqia",Personal clearly majority few. Him really them.,81,28,523,248,Egypt,Abu Kebir,865-7889,465.0
249,Local Moving Assistance,"Load and unload moving trucks with furniture, boxes, appliances, and other household items.",done,2020-03-15T04:58:12-03:06,2020-11-23T23:50:25-07:01,"53 Gamal Abdel Nasser Street, Armant, Luxor",How oil series season design least.,77,5,352,249,Egypt,Armant,283-4237,445.0
250,Mobile App Development Services,"Design intuitive and user-friendly mobile app interfaces, wireframes, and prototypes that prioritize usability, accessibility, and engagement.",done,2020-09-15T23:04:28-05:08,2020-01-27T02:05:21-09:02,"99 Gezira Street, Banha, Qalyubia",Action government American side.,10,28,299,250,Egypt,Banha,743-3734,840.0
251,Appliance Installation Assistance,"Ensure proper wiring, grounding, and connection of appliances to prevent electrical problems and ensure optimal performance",done,2020-04-23T19:36:45-00:04,2023-08-21T21:12:08-07:09,"16 Al Nahda Street, Mansoura, Dakahlia",Interesting toward game.,31,12,427,251,Egypt,Mansoura,839-1478,760.0
252,Scheduled Maintenance Inspections,"Conduct regular maintenance inspections of electrical systems, including wiring, panels, and devices, to identify potential issues and prevent electrical failures",open,2021-09-07T18:45:43-01:01,2021-05-19T13:07:54-06:04,"98 El Galaa Street, Marsa Matruh, Matrouh",Reason structure decade produce.,16,12,416,252,Egypt,Marsa Matruh,780-4351,370.0
253,Language Lessons,Offer personalized language lessons and tutoring sessions for individuals and small groups seeking to improve their language skills,done,2023-11-19T04:20:28-01:02,2022-08-11T03:22:39-08:07,"92  El Obour Street, Beni Suef, Beni Suef",Book lead sea month.,61,54,155,253,Egypt,Beni Suef,167-1371,430.0
254,Web Application Development,"Utilize front-end technologies like HTML, CSS, JavaScript, and back-end frameworks like Node.js, Django, and Ruby on Rails",open,2020-02-21T09:59:05-08:09,2020-08-21T16:39:09-02:03,"38 El Galaa Street, Dar El Salam, Sohag",Half morning key price physical whatever.,16,28,420,254,Egypt,Dar El Salam,469-0005,350.0
255,Mobile Car Wash Service,Offer flexible scheduling options and competitive pricing for mobile car wash services.,done,2024-01-14T19:40:02-01:01,2020-08-02T03:51:09-08:06,"44 Al Ahram Street, Ras El Bar, Kafr El Sheikh",Camera body occur during process against with.,71,8,386,255,Egypt,Ras El Bar,856-8352,565.0
256,Version Control Integration,"Integrate version control systems such as Git or SVN into development workflows to track changes, collaborate with team members, and manage code repositories effectively",done,2020-03-21T13:05:01-08:01,2021-10-20T02:29:47-00:09,"65 El Thawra Street, Bir al-Abed, North Sinai",Fast single piece our fish according spring.,30,28,717,256,Egypt,Bir al-Abed,490-0139,565.0
257,Interactive Learning Modules,"Incorporate videos, animations, simulations, and interactive exercises to create immersive learning experiences",cancelled,2023-01-06T13:21:44-08:08,2020-04-23T22:51:19-07:00,"84 El Thawra Street, Marsa Alam, Red Sea",We party three office new time ten.,8,82,806,257,Egypt,Marsa Alam,104-3041,715.0
258,Emergency Electrical Repairs,"Provide 24/7 emergency electrical repair services to address sudden power outages, electrical fires, and other urgent issues",pending,2021-10-22T11:46:46-03:06,2021-04-07T13:22:17-09:08,"91  El Obour Street, Al-Wasta, Beni Suef",Name too house impact down.,43,12,555,258,Egypt,Al-Wasta,254-9631,615.0
259,Mobile Car Wash Service,"Clean and polish car surfaces to remove dirt, grime, dust, and stains, leaving vehicles spotless and shiny.",cancelled,2024-05-07T00:47:15-02:04,2021-05-08T03:41:23-08:00,"08 Gezira Street, Al-Hawamidiyya, Giza",Realize Democrat official either blood.,40,8,409,259,Egypt,Al-Hawamidiyya,629-6662,195.0
260,3D Animation Production,"Produce high-quality 3D animations for films, television, video games, and advertising campaigns",open,2023-01-01T18:43:19-05:06,2022-11-19T01:06:21-01:03,"14 El Haram Street, Kafr El-Battikh, Damietta",President source help.,84,58,656,260,Egypt,Kafr El-Battikh,677-7744,940.0
261,Personalized Home Cooking,"Provide customized meal plans, weekly menus, and cooking lessons for clients seeking healthy and convenient food options.",pending,2023-09-28T10:55:33-09:05,2020-08-17T19:33:27-01:05,"76 El Haram Street, Hurghada, Red Sea",Kitchen see help treatment fast.,34,9,118,261,Egypt,Hurghada,345-0132,80.0
262,Content Platform Integration,"Integrate course content with online learning platforms such as Moodle, Canvas, or Blackboard, ensuring compatibility, accessibility, and seamless user experience",open,2023-04-29T23:24:54-02:01,2021-01-11T09:26:04-05:09,"41 Al-Azhar Street, Armant, Luxor",Job ready person group newspaper.,1,82,386,262,Egypt,Armant,848-8668,195.0
263,Furniture Assembly Assistance,"Offer efficient and reliable furniture assembly assistance for residential and commercial clients, including IKEA furniture and other flat-pack items.",pending,2021-10-11T09:33:47-07:03,2022-10-06T18:35:47-07:09,"49 Al Horreya Street, Rafah, North Sinai",Join too manager window really nothing career.,91,13,971,263,Egypt,Rafah,053-7659,350.0
264,Market Research and Analysis,"Develop competitive intelligence profiles, market segmentation models, customer personas, and SWOT analyses to inform marketing strategies, product development, and business planning initiatives.",done,2021-04-20T09:08:59-05:02,2023-07-06T20:16:00-01:03,"65 Gamal Abdel Nasser Street, Bir al-Abed, North Sinai",Country probably among.,15,19,890,264,Egypt,Bir al-Abed,481-5608,595.0
265,Legal Writing and Documentation Services,"Prepare persuasive legal briefs, motions, and pleadings for court proceedings, administrative hearings, and alternative dispute resolution processes, presenting clients' cases effectively and compellingly.",open,2021-05-13T03:40:15-07:05,2021-09-29T08:26:52-05:04,"86 El Nasr Street, Abnub, Asyut",Art way serve yard happen according.,93,29,498,265,Egypt,Abnub,869-5213,510.0
266,SEO Optimization Services,"Monitor SEO performance metrics such as organic traffic, keyword rankings, backlink profile, and conversion rates using analytics tools to measure success and refine strategies over time.",done,2022-05-26T13:10:16-04:05,2020-07-10T09:12:24-06:07,"09 Gamal Abdel Nasser Street, Nuweiba, South Sinai",Garden possible information meet car move base.,98,32,986,266,Egypt,Nuweiba,920-3723,635.0
267,ESL/EFL Instruction,Provide English as a Second Language (ESL) or English as a Foreign Language (EFL) instruction to non-native speakers of English,cancelled,2022-11-23T16:56:58-02:00,2024-03-13T18:17:19-03:02,"98 Al Nile Street, Beni Suef, Beni Suef",Social tree special four girl worker.,95,54,691,267,Egypt,Beni Suef,340-4856,510.0
268,Financial Statement Analysis,"Identify trends, variances, and key financial metrics to support decision-making, forecasting, and strategic planning",done,2022-12-13T13:03:16-04:05,2022-05-25T15:13:57-09:01,"23 El Gaish Street, Kharga, New Valley",Generation boy clear prevent.,92,37,648,268,Egypt,Kharga,941-4857,510.0
269,SEO-Friendly Design Strategies,"Optimize on-page elements, metadata, site structure, and URL structures to enhance crawlability, indexability, and relevance for target keywords",cancelled,2021-11-24T02:18:24-09:03,2022-11-08T13:41:38-00:00,"65 El Haram Street, Tanta, Gharbia",Turn ever magazine color result watch.,61,31,455,269,Egypt,Tanta,072-8973,150.0
270,Interactive Learning Modules,"Design interactive learning modules and multimedia presentations to enhance student engagement, comprehension, and retention",open,2024-01-15T09:16:33-02:06,2023-04-14T02:59:08-05:01,"56 Abu Bakr El Seddik Street, Kafr El-Zayat, Gharbia",Gas back couple inside raise.,80,82,976,270,Egypt,Kafr El-Zayat,948-3105,890.0
271,Home Maintenance Assistance,"Repair minor issues such as leaky faucets, squeaky doors, loose handles, and faulty electrical outlets to prevent further damage.",cancelled,2022-07-04T11:39:15-07:06,2021-01-29T18:47:31-04:04,"91 Lebanon Street, Dahab, South Sinai",Compare through use account.,67,10,975,271,Egypt,Dahab,724-0299,80.0
272,Motion Graphics Design,"Utilize motion design principles, typography, and animation techniques to convey information and captivate audiences",cancelled,2021-09-23T17:24:36-05:04,2021-02-12T07:50:01-04:00,"61 Al Horreya Street, Bani Mazar, Minya",Key law national always main gas.,11,58,266,272,Egypt,Bani Mazar,627-5174,130.0
273,Content Creation Services,"Tailor content to specific platforms, audiences, and objectives, optimizing it for search engines, social sharing, and user engagement.",pending,2021-11-13T22:17:51-02:01,2021-02-08T20:13:01-06:01,"35 El Nasr Street, Dahab, South Sinai",Move generation space smile wrong scene.,25,18,409,273,Egypt,Dahab,863-2596,830.0
274,Appliance Installation Assistance,"Assist clients with the installation of electrical appliances such as ceiling fans, light fixtures, ovens, and HVAC systems",cancelled,2023-01-04T01:05:53-04:01,2020-05-23T23:10:12-08:00,"68 Al Horreya Street, Talkha, Dakahlia",Future door drug good off room.,84,12,491,274,Egypt,Talkha,239-8824,115.0
275,Language Proficiency Assessment,"Administer standardized tests, oral interviews, and writing samples to assess language proficiency accurately",done,2021-08-05T21:50:05-06:07,2021-09-01T08:15:59-08:03,"93 El Nasr Street, Luxor, Qena",Role fill interview lose.,72,54,281,275,Egypt,Luxor,645-9597,515.0
276,Emergency Electrical Repairs,"Diagnose and repair faulty wiring, overloaded circuits, and electrical hazards promptly to restore power and ensure safety",open,2020-12-08T19:29:48-04:07,2023-11-23T16:42:49-05:04,"01 Ahmed Orabi Street, Tanta, Gharbia",Box able chair wrong.,97,12,445,276,Egypt,Tanta,201-4406,150.0
277,Kitchen Plumbing Installation,Replace old and faulty kitchen plumbing components with new ones to prevent leaks and water damage.,pending,2022-05-19T20:08:22-01:04,2020-05-26T07:46:10-09:07,"70 Salah Salem Street, Dahab, South Sinai",But score worry line enough stay above.,84,2,182,277,Egypt,Dahab,907-7197,905.0
278,Cultural Exchange Programs,"Organize cultural exchange programs and language immersion experiences for students to learn about different cultures, traditions, and customs while practicing language skills in authentic settings",cancelled,2020-01-19T21:06:59-00:06,2020-03-01T18:37:03-01:05,"60 El Haram Street, Mitt Ghamr, Dakahlia",Eat figure likely heavy system serve represent.,37,54,817,278,Egypt,Mitt Ghamr,306-2740,100.0
279,Visual Effects Compositing,"Use compositing software such as Adobe After Effects, Nuke, or Fusion to integrate elements, adjust colors, and add atmospheric effects",done,2024-02-28T00:07:53-04:01,2022-07-22T02:53:57-03:05,"46 Al-Azhar Street, 6th of October City, Giza",Industry nor simply as now card writer early.,50,58,847,279,Egypt,6th of October City,124-8423,445.0
280,Local Moving Assistance,"Transport items to the new location using appropriate vehicles and equipment, ensuring timely delivery.",pending,2020-05-12T05:11:03-00:03,2020-08-27T16:04:32-00:00,"13 Gamal Abdel Nasser Street, Ismailia, Ismailia",End watch hospital dream face treat.,1,5,282,280,Egypt,Ismailia,914-7004,620.0
281,Cross-Browser Compatibility Testing,"Conduct cross-browser compatibility testing to ensure website functionality and performance consistency across different web browsers such as Chrome, Firefox, Safari, and Edge",done,2021-07-01T22:05:43-09:06,2023-05-07T11:07:50-07:02,"03 Al Nile Street, Port Fuad, Port Said",News total run often yeah.,86,31,154,281,Egypt,Port Fuad,210-6455,975.0
282,Market Research and Analysis,"Collect and analyze primary and secondary research sources, including surveys, interviews, focus groups, industry reports, and market data, to identify opportunities, threats, and growth drivers.",open,2023-05-31T16:59:43-01:08,2024-03-02T22:05:38-02:09,"93 El Nozha Street, Farafra, New Valley",Remember issue range similar like hour which.,100,19,698,282,Egypt,Farafra,867-1373,885.0
283,Deep Cleaning Service,"Thoroughly clean and sanitize all surfaces, including floors, walls, countertops, and fixtures.",pending,2022-05-02T23:37:38-05:08,2023-02-25T16:00:32-07:08,"76 Gamal Abdel Nasser Street, Giza, Giza",Certainly than believe individual be newspaper.,44,4,398,283,Egypt,Giza,796-4225,895.0
284,Cross-Browser Compatibility Testing,"Conduct cross-browser compatibility testing to ensure website functionality and performance consistency across different web browsers such as Chrome, Firefox, Safari, and Edge",cancelled,2022-12-27T07:36:17-07:04,2020-02-19T04:56:34-04:01,"43 Al Nahda Street, Kharga, New Valley",Have total because pretty.,47,31,437,284,Egypt,Kharga,453-7809,830.0
285,Legal Writing and Documentation Services,"Offer professional legal writing and documentation services for law firms, businesses, and individuals, including contracts, agreements, legal briefs, memos, opinions, and court documents.",pending,2020-03-15T19:46:53-00:00,2024-06-23T02:51:50-04:07,"58 Al-Azhar Street, Rafah, North Sinai",Stand discussion nature up.,48,29,651,285,Egypt,Rafah,812-9501,140.0
286,Blockchain Development Services,"Offer blockchain maintenance and support services, including node management, network monitoring, security audits, and protocol upgrades, to ensure the stability, performance, and resilience of blockchain ecosystems.",cancelled,2024-06-19T02:27:12-08:07,2020-07-04T09:22:46-05:03,"21 October Street, Abu Kebir, Sharqia",Tonight far responsibility build.,52,20,764,286,Egypt,Abu Kebir,426-9519,790.0
287,Language Lessons,"Tailor lessons to students' proficiency levels, learning styles, and language goals, covering grammar, vocabulary, pronunciation, and conversation practice",pending,2020-10-13T08:06:40-00:03,2022-04-24T14:06:39-04:05,"63 El Nozha Street, Kafr El-Battikh, Damietta",Thing and this development half fire nice.,19,54,269,287,Egypt,Kafr El-Battikh,956-9044,515.0
288,SEO Optimization Services,"Conduct keyword research, competitor analysis, and site audits to identify SEO opportunities, gaps, and areas for improvement.",open,2021-11-19T14:02:29-05:01,2022-02-22T09:06:13-09:09,"25 El Thawra Street, Siwa, Matrouh",Expect part morning trade.,46,32,737,288,Egypt,Siwa,234-4211,440.0
289,Database Management Systems,"Design and implement database management systems (DBMS) for storing, managing, and retrieving data efficiently",pending,2021-01-07T03:28:12-08:02,2021-10-11T14:52:08-06:08,"95 Al-Azhar Street, Shubra El-Kheima, Qalyubia",School down can job opportunity home growth.,73,28,304,289,Egypt,Shubra El-Kheima,518-5647,185.0
