task_id,title,Descr,status,posting_date,deadline_date,Address,note,Employee_id,category_id,payments_id,reviews_id,country,city,price_range,price
144,ESL/EFL Instruction,Provide English as a Second Language (ESL) or English as a Foreign Language (EFL) instruction to non-native speakers of English,cancelled,2021-09-25T16:35:01-07:09,2022-04-20T20:59:49-09:05,"08 October Street, Asyut, Asyut",Few painting morning war.,22,54,503,144,Egypt,Asyut,709-1817,755.0
145,Appliance Installation Assistance,"Ensure proper wiring, grounding, and connection of appliances to prevent electrical problems and ensure optimal performance",done,2021-11-08T10:30:23-02:08,2023-09-26T09:11:24-07:05,"86 Gamal Abdel Nasser Street, Tal El Kabir, Ismailia",Structure smile key skill some.,97,12,521,145,Egypt,Tal El Kabir,633-8151,620.0
146,electrical help,"Troubleshooting Services: Troubleshoot electrical problems such as flickering lights, tripping breakers, and power surges to identify the underlying causes and recommend appropriate solutions. Use diagnostic tools and techniques to pinpoint electrical faults and restore functionality safely.",done,2021-01-06T21:54:38-01:09,2020-06-16T00:17:47-06:06,"48 Al Nahda Street, Shibin El Kom, Monufia",Population every laugh.,77,28,339,146,Egypt,Shibin El Kom,607-2547,840.0
147,Social Media Marketing Campaign,"Provide strategic recommendations and insights based on social media data analysis, industry trends, and competitive benchmarks to guide decision-making and achieve marketing objectives.",done,2022-03-13T22:27:11-04:06,2022-03-26T23:24:42-08:05,"53 Talaat Harb Street, Akhmim, Sohag",Yes listen use in deep major grow owner.,28,33,375,147,Egypt,Akhmim,231-6811,885.0
148,Conversation Practice Sessions,"Lead discussions, role-plays, debates, and storytelling activities on various topics, themes, and current events",pending,2020-10-09T09:35:33-06:00,2022-01-04T17:05:29-04:03,"68 El Haram Street, Ataqah, Suez",If son after day room structure kitchen.,12,54,521,148,Egypt,Ataqah,429-2953,880.0
149,Multilingual Course Development,"Translate course content, subtitles, and instructions into multiple languages to facilitate accessibility and inclusivity",done,2022-08-31T11:56:07-09:09,2024-05-08T11:44:27-02:05,"71 Gamal Abdel Nasser Street, Maghagha, Minya",Wind despite fall hour.,8,82,201,149,Egypt,Maghagha,814-6106,20.0
150,Generative AI Solutions,"Implement generative AI systems that can autonomously create art, music, stories, and designs in various styles, genres, and formats, mimicking human creativity and imagination.",pending,2022-03-21T04:14:48-03:07,2022-09-12T07:12:00-01:05,"19 July 26th Street, Nasser, Beni Suef",Recently street travel street couple.,1,30,352,150,Egypt,Nasser,065-2210,520.0
151,Air Conditioner Installation,"Assess cooling requirements, select suitable air conditioning units, and determine the best placement for installation based on space layout and usage patterns.",pending,2023-02-11T10:12:34-04:09,2022-07-26T17:07:11-01:08,"97 Salah Salem Street, Siwa, Matrouh",Player explain see.,37,11,659,151,Egypt,Siwa,576-1775,345.0
152,Database Management Systems,"Design and implement database management systems (DBMS) for storing, managing, and retrieving data efficiently",pending,2023-07-14T11:37:51-02:05,2020-05-15T02:19:21-03:08,"79 Gezira Street, Fayed, Ismailia",Act pass him discuss child situation nearly.,70,28,337,152,Egypt,Fayed,100-0736,760.0
153,Instructional Design Consulting,Collaborate with stakeholders to design effective and engaging online learning experiences,pending,2021-07-08T20:51:13-06:08,2021-12-10T13:04:49-09:00,"25 Al Nile Street, Rafah, North Sinai",Baby manager pattern different detail town.,69,82,351,153,Egypt,Rafah,128-3855,760.0
154,Legal Writing and Documentation Services,"Conduct legal research, analysis, and case reviews to support legal arguments, claims, and defenses in various practice areas, such as civil litigation, corporate law, intellectual property, and real estate.",done,2020-01-22T06:01:47-01:07,2021-05-20T22:27:23-01:04,"45 Al Nahda Street, Shubra El-Kheima, Cairo",Than model reflect value example although.,98,29,922,154,Egypt,Shubra El-Kheima,543-2138,655.0
155,Storyboard Development,"Develop storyboards and animatics to visualize and plan animation sequences, shot compositions, and narrative flow",open,2022-06-18T02:40:04-00:02,2023-02-23T03:11:48-09:08,"66 Salah Salem Street, Dahab, South Sinai",Use fund step buy vote world rich.,5,58,169,155,Egypt,Dahab,497-9296,335.0
156,Web Application Development,"Utilize front-end technologies like HTML, CSS, JavaScript, and back-end frameworks like Node.js, Django, and Ruby on Rails",open,2021-08-27T15:40:46-05:03,2021-12-15T10:40:31-02:06,"10 Salah Salem Street, Rafah, North Sinai",Couple brother inside this.,35,28,405,156,Egypt,Rafah,796-5397,70.0
157,Management Consulting Services,"Offer management consulting services to help businesses optimize financial performance, streamline operations, and achieve strategic objectives",cancelled,2023-10-02T04:12:04-05:09,2020-04-08T17:20:54-07:06,"19 Al Nahda Street, Giza, Cairo",Never decade maintain.,66,37,675,157,Egypt,Giza,263-1925,580.0
158,International Shipping Solutions,"Coordinate the shipment of goods and merchandise to destinations worldwide, including customs clearance and documentation.",done,2021-07-08T09:43:07-05:06,2024-01-21T02:44:49-05:09,"76 El Nasr Street, Zagazig, Sharqia",Agreement health eight star.,87,7,862,158,Egypt,Zagazig,567-6928,385.0
159,Storyboard Development,"Create sketches, thumbnails, and animatics to storyboard key scenes, camera angles, and character actions for animation projects",cancelled,2024-02-20T20:55:21-02:06,2023-01-06T21:04:59-07:05,"62 Al-Azhar Street, 6th of October City, Giza",Big especially account me chair.,60,58,431,159,Egypt,6th of October City,074-5150,970.0
160,Custom Software Development,Develop custom software solutions tailored to the unique needs and requirements of businesses and organizations,pending,2021-11-17T07:30:09-07:06,2024-04-11T00:49:38-01:06,"55 Al Nile Street, Cairo, Cairo",These statement common authority.,68,28,794,160,Egypt,Cairo,816-4416,750.0
161,Web Application Development,"Create dynamic and interactive web applications for clients in diverse industries, incorporating user-friendly interfaces, responsive design, and scalable architecture",open,2022-09-08T23:20:41-07:07,2022-12-27T14:33:15-08:08,"54 Abu Bakr El Seddik Street, Talkha, Dakahlia",Authority high science. Take loss born media.,63,28,772,161,Egypt,Talkha,922-9656,585.0
162,Bilingual Education Support,Assist bilingual students and multilingual learners in developing proficiency in their primary and secondary languages,done,2022-02-25T21:18:16-03:00,2020-03-15T16:07:28-01:08,"23 July 26th Street, Nasser, Beni Suef",Suggest way long brother.,4,54,491,162,Egypt,Nasser,699-1373,620.0
163,Personalized Home Cooking,"Offer personalized home cooking services tailored to individual tastes, dietary preferences, and nutritional needs.",pending,2023-02-08T23:27:00-03:03,2024-01-14T12:03:30-00:08,"59 El Thawra Street, Edfu, Aswan",Again democratic sort drive.,45,9,244,163,Egypt,Edfu,286-9307,65.0
164,Tax Planning and Preparation,"Prepare and file tax returns, including income tax, payroll tax, sales tax, and property tax filings",pending,2020-08-29T09:50:28-06:00,2022-11-06T08:37:23-04:08,"41 Al Nahda Street, Suez, Suez",Brother clear new write.,5,37,153,164,Egypt,Suez,097-0542,355.0
165,Market Research and Analysis,"Stay informed about market developments, emerging trends, regulatory changes, and competitive threats through continuous monitoring, analysis, and synthesis of relevant information.",pending,2021-08-30T11:58:42-03:09,2020-09-16T17:41:25-06:01,"35 El Gaish Street, Port Said, Port Said",Study beat better final yeah thousand law.,17,19,553,165,Egypt,Port Said,540-2238,550.0
166,Generative AI Solutions,"Implement generative AI systems that can autonomously create art, music, stories, and designs in various styles, genres, and formats, mimicking human creativity and imagination.",pending,2023-01-12T06:27:06-05:02,2022-05-11T04:15:14-09:09,"57 Lebanon Street, Farafra, New Valley",Picture majority dream particularly.,8,30,363,166,Egypt,Farafra,135-8613,795.0
167,Language Proficiency Assessment,"Administer standardized tests, oral interviews, and writing samples to assess language proficiency accurately",open,2023-03-05T11:21:18-05:05,2021-03-16T13:13:28-00:00,"62 Al Nahda Street, Tal El Kabir, Ismailia",One world action sound toward floor blue.,58,54,740,167,Egypt,Tal El Kabir,487-8724,110.0
168,Conversation Practice Sessions,"Facilitate conversational practice sessions for language learners to improve fluency, confidence, and oral communication skills",pending,2023-10-03T01:56:57-06:03,2023-07-16T05:04:22-03:05,"42 July 26th Street, Tal El Kabir, Ismailia",There however huge down. Mean issue method see.,96,54,929,168,Egypt,Tal El Kabir,357-5410,375.0
169,Version Control Integration,"Implement branching strategies, code reviews, and continuous integration (CI) pipelines to streamline development processes",pending,2020-02-15T08:58:14-03:02,2024-04-09T12:58:04-05:09,"01 El Galaa Street, Al-Zohra, Port Said",Five car item month election many soon soon.,41,28,857,169,Egypt,Al-Zohra,200-9397,985.0
170,Database Management Systems,"Design and implement database management systems (DBMS) for storing, managing, and retrieving data efficiently",done,2021-08-10T13:05:48-07:02,2023-04-21T21:55:53-09:04,"57 El Kornish Street, Giza, Cairo",Body teach several find trip building.,88,28,576,170,Egypt,Giza,496-8191,480.0
171,Furniture Assembly Assistance,"Assemble a wide range of furniture pieces such as beds, sofas, tables, chairs, desks and shelves.",done,2021-11-15T21:33:50-08:01,2020-01-01T10:36:28-05:03,"80 October Street, Shubra El-Kheima, Qalyubia",Indeed surface fire power child television four.,52,13,186,171,Egypt,Shubra El-Kheima,785-7065,275.0
172,Cultural Exchange Programs,"Plan and coordinate international exchange trips, homestays, and cultural activities",done,2020-03-16T20:48:25-08:03,2020-02-22T16:40:24-01:02,"71 October Street, Ataqah, Suez",Decision many modern once property.,39,54,482,172,Egypt,Ataqah,023-8692,105.0
173,Mobile App Prototyping,"Create interactive prototypes using tools like Adobe XD, Sketch, or Figma to visualize app features and gather feedback from stakeholders",pending,2020-06-04T16:36:45-03:00,2024-02-19T13:52:18-07:00,"93 Salah Salem Street, Al-Hawamidiyya, Giza",Share require than learn property light early.,7,28,524,173,Egypt,Al-Hawamidiyya,030-6205,420.0
174,Character Animation Rigging,"Rig and animate characters for 2D and 3D animation projects, including bipedal and quadrupedal characters, creatures, and mechanical objects",done,2021-04-27T15:13:00-09:08,2023-01-17T19:05:47-02:07,"71 El Gaish Street, Arish, North Sinai",By article our.,80,58,786,174,Egypt,Arish,816-1047,35.0
175,UI/UX Optimization,"Conduct usability testing, user research, and A/B testing to gather feedback and iteratively improve website navigation, layout, and interaction flows",open,2023-04-24T07:33:11-01:03,2021-03-27T16:14:12-00:07,"42 Al-Azhar Street, Zefta, Gharbia",Half though treat. Top among career around if.,76,31,190,175,Egypt,Zefta,782-7690,135.0
176,Education Content Creation,"Develop engaging and informative educational content for online courses, tutorials, and learning resources",open,2020-12-03T05:10:26-09:06,2024-01-01T00:44:07-05:08,"61 Al Nahda Street, El-Qoseir, Red Sea",Then hair pay. Must son theory.,56,82,631,176,Egypt,El-Qoseir,234-6886,690.0
177,Management Consulting Services,"Provide expert advice and recommendations on budgeting, forecasting, cost analysis, and profitability improvement strategies",cancelled,2023-09-19T18:21:12-07:02,2020-06-03T22:23:18-06:01,"87 El Kornish Street, Faiyum, Faiyum",Serve stand admit seven less.,46,37,890,177,Egypt,Faiyum,333-0587,695.0
178,Data Entry and Analysis Services,"Utilize data visualization tools and techniques to present findings in clear and compelling formats, such as charts, graphs, dashboards, and reports.",open,2022-04-19T02:50:28-02:05,2020-01-31T18:02:06-04:02,"98 Al-Azhar Street, Rafah, North Sinai",Really lose network oil on.,9,15,287,178,Egypt,Rafah,865-9612,145.0
179,Scheduled Maintenance Inspections,"Check for signs of wear, corrosion, and damage, and perform preventive maintenance tasks such as cleaning, tightening connections, and testing components",cancelled,2021-11-27T21:58:46-04:01,2021-05-26T02:36:12-05:06,"71 El Kornish Street, Sohag, Sohag",Economic generation only first.,19,12,647,179,Egypt,Sohag,543-5898,790.0
180,Deep Cleaning Service,"Remove dirt, dust, grime, and stains from hard-to-reach areas using specialized cleaning equipment.",open,2020-05-13T18:47:13-03:07,2022-01-19T06:19:53-09:08,"99 El Gaish Street, Tal El Kabir, Ismailia",Down institution area house develop analysis.,45,4,872,180,Egypt,Tal El Kabir,387-6497,90.0
181,Bilingual Education Support,"Offer language support, academic enrichment, and cultural integration activities to promote bilingualism and biliteracy",cancelled,2024-05-14T16:19:33-02:04,2023-08-16T19:05:17-04:08,"01 El Kornish Street, Luxor, Luxor",South field little.,43,54,176,181,Egypt,Luxor,594-8455,245.0
182,Multilingual Course Development,"Translate course content, subtitles, and instructions into multiple languages to facilitate accessibility and inclusivity",cancelled,2021-10-17T04:25:34-01:09,2024-01-27T05:15:02-07:03,"30 El Kornish Street, Dahab, South Sinai",Black claim summer so sea business leave.,86,82,776,182,Egypt,Dahab,585-3692,850.0
183,Interactive Learning Modules,"Incorporate videos, animations, simulations, and interactive exercises to create immersive learning experiences",cancelled,2023-07-01T09:32:33-08:06,2023-07-31T13:53:03-01:01,"45 Abu Bakr El Seddik Street, Cairo, Cairo",Section none break drop sing appear.,56,82,564,183,Egypt,Cairo,571-3523,375.0
184,Generative AI Solutions,"Implement generative AI systems that can autonomously create art, music, stories, and designs in various styles, genres, and formats, mimicking human creativity and imagination.",pending,2020-06-16T06:20:20-03:09,2020-08-05T23:41:33-01:04,"10 Salah Salem Street, Minya, Minya",By course class set beyond above image.,47,30,696,184,Egypt,Minya,810-6567,525.0
185,entertainment centers,"Offer on-site assembly services at the client's location, whether at home, office, or commercial space, for added convenience and efficiency.",done,2024-03-26T18:50:27-08:01,2023-07-24T15:44:05-00:03,"20 Gezira Street, Port Fuad, Port Said",Value instead old also.,13,13,875,185,Egypt,Port Fuad,093-8687,735.0
186,Abstract Canvas Painting,"Create stunning abstract canvas paintings using acrylics, oils, or mixed media techniques.",pending,2023-05-02T05:25:29-03:03,2023-08-31T08:08:12-04:09,"00 Al Nahda Street, Marsa Matruh, Matrouh",See daughter themselves rock she.,31,3,657,186,Egypt,Marsa Matruh,074-3324,515.0
187,Graphic Design Enhancements,"Enhance website visuals and aesthetics with custom graphics, icons, illustrations, and animations that reflect brand identity and communicate key messages effectively",done,2022-09-28T15:04:58-04:01,2022-09-30T16:38:29-03:06,"01 Abu Bakr El Seddik Street, Tamiya, Faiyum",Best play book. Administration news stop.,23,31,712,187,Egypt,Tamiya,317-0283,155.0
188,Mobile Car Wash Service,"Provide additional services such as waxing, polishing, vacuuming, and odor removal for a complete car cleaning experience.",pending,2020-01-25T02:20:12-00:03,2024-05-14T02:39:29-07:02,"58 Abu Bakr El Seddik Street, Ismailia, Ismailia",Cultural wall experience surface less.,54,8,279,188,Egypt,Ismailia,223-6012,590.0
189,Cross-Browser Compatibility Testing,"Identify and resolve compatibility issues related to HTML, CSS, JavaScript, and browser rendering engines",done,2022-07-30T01:47:43-04:05,2022-06-05T10:20:44-06:03,"79 Salah Salem Street, Sohag, Asyut",Compare school subject year size size worry.,35,31,712,189,Egypt,Sohag,405-8773,265.0
190,Responsive Website Redesign,"Redesign existing websites to be mobile-responsive, ensuring optimal viewing and interaction experiences across all devices and screen sizes",open,2022-02-25T15:41:40-02:02,2020-03-06T12:31:21-02:03,"44 Al Horreya Street, Dahab, South Sinai",Establish else family upon difference community.,88,31,766,190,Egypt,Dahab,406-7851,620.0
191,UI/UX Optimization,"Conduct usability testing, user research, and A/B testing to gather feedback and iteratively improve website navigation, layout, and interaction flows",pending,2022-04-16T14:21:30-05:07,2021-11-02T15:42:46-00:07,"16 Gamal Abdel Nasser Street, Al-Wasta, Beni Suef",Employee front race.,78,31,878,191,Egypt,Al-Wasta,764-1396,335.0
192,Legal Writing and Documentation Services,"Provide professional editing, proofreading, and document review services to ensure accuracy, consistency, and compliance with legal standards and conventions.",cancelled,2021-02-28T20:54:26-01:01,2020-01-26T14:18:33-08:03,"14 El Haram Street, Luxor, Qena",Compare world figure no yourself.,56,29,763,192,Egypt,Luxor,099-1461,15.0
193,Air Conditioner Installation,"Ensure proper sizing, mounting, and connection of air conditioning equipment, including refrigerant lines, electrical wiring, and drainage systems.",open,2021-02-10T14:56:47-07:00,2021-05-27T01:32:32-01:08,"82 El Nasr Street, Rafah, North Sinai",So sure moment product.,59,11,355,193,Egypt,Rafah,666-1172,190.0
194,ESL/EFL Instruction,Provide English as a Second Language (ESL) or English as a Foreign Language (EFL) instruction to non-native speakers of English,done,2020-10-30T00:48:41-07:06,2022-01-09T10:27:25-06:00,"28 October Street, Marsa Alam, Red Sea",Car little organization.,16,54,797,194,Egypt,Marsa Alam,141-7916,400.0
195,Kitchen Plumbing Installation,"Repair and troubleshoot kitchen plumbing issues such as clogged drains, leaky pipes, and low water pressure.",done,2022-04-04T15:48:55-06:02,2021-11-17T17:15:55-00:02,"44 Al-Azhar Street, Beni Suef, Beni Suef",Often likely strategy partner expect.,54,2,154,195,Egypt,Beni Suef,195-9391,155.0
196,Scheduled Maintenance Inspections,"Check for signs of wear, corrosion, and damage, and perform preventive maintenance tasks such as cleaning, tightening connections, and testing components",pending,2021-09-20T10:18:48-05:09,2020-12-09T05:56:36-04:06,"24 Al-Azhar Street, Shubra El-Kheima, Qalyubia",Cut positive avoid executive since.,99,12,322,196,Egypt,Shubra El-Kheima,704-2032,895.0
197,Financial Planning Consultation,"Educate clients on financial literacy, investment principles, retirement planning strategies, and wealth-building techniques to empower them to make smart financial decisions and achieve financial independence.",cancelled,2022-05-26T14:07:45-04:07,2021-08-28T15:09:41-08:02,"60 Al Horreya Street, Shibin El Kom, Monufia",Although attack imagine decide.,73,38,528,197,Egypt,Shibin El Kom,122-9420,885.0
198,Mobile App Prototyping,"Create interactive prototypes using tools like Adobe XD, Sketch, or Figma to visualize app features and gather feedback from stakeholders",open,2023-07-22T17:49:43-04:04,2024-06-14T12:00:05-08:01,"14 El Nozha Street, Kafr Abdou, Alexandria",Board play control person common kid east.,73,28,481,198,Egypt,Kafr Abdou,123-0510,195.0
199,Blockchain Development Services,"Design and develop custom blockchain solutions, including public and private networks, smart contracts, tokens, and decentralized applications (DApps), tailored to specific use cases and industry requirements.",pending,2021-04-24T08:35:33-07:01,2021-08-31T05:52:21-00:00,"78 Ahmed Orabi Street, Kafr Abdou, Alexandria",Prepare himself with. Safe all question design.,75,20,480,199,Egypt,Kafr Abdou,980-2931,995.0
200,Multilingual Course Development,"Translate course content, subtitles, and instructions into multiple languages to facilitate accessibility and inclusivity",open,2022-03-14T03:31:23-04:02,2022-02-25T06:02:39-00:07,"76 Al Ahram Street, Siwa, Matrouh",Memory reason go him.,3,82,973,200,Egypt,Siwa,146-5496,855.0
201,Express Delivery Service,"Offer flexible delivery options, including same-day delivery, next-day delivery, and scheduled deliveries.",pending,2022-06-19T07:51:43-03:08,2022-10-24T07:40:47-04:00,"23 July 26th Street, Bir al-Abed, North Sinai",Since this particularly part of onto put.,23,6,641,201,Egypt,Bir al-Abed,451-6625,175.0
202,Language Proficiency Assessment,"Administer standardized tests, oral interviews, and writing samples to assess language proficiency accurately",done,2021-07-28T01:31:22-05:09,2021-10-23T17:27:39-01:01,"26 El Kornish Street, Luxor, Qena",Door whatever help entire cold fly Mrs.,9,54,159,202,Egypt,Luxor,895-2649,915.0
203,Legal Writing and Documentation Services,"Provide professional editing, proofreading, and document review services to ensure accuracy, consistency, and compliance with legal standards and conventions.",cancelled,2020-06-07T12:02:35-03:03,2022-08-01T21:31:04-07:06,"59  El Obour Street, Armant, Luxor",Board people memory population.,27,29,798,203,Egypt,Armant,520-8169,620.0
204,Mobile App Prototyping,"Create interactive prototypes using tools like Adobe XD, Sketch, or Figma to visualize app features and gather feedback from stakeholders",done,2020-01-06T02:28:47-00:05,2023-05-06T12:46:14-05:09,"06 Al Nile Street, Nag Hammadi, Qena",General certain admit.,58,28,693,204,Egypt,Nag Hammadi,755-4525,730.0
205,Scheduled Maintenance Inspections,"Check for signs of wear, corrosion, and damage, and perform preventive maintenance tasks such as cleaning, tightening connections, and testing components",done,2024-01-18T01:22:56-02:07,2021-01-23T06:46:49-08:04,"80 Al Nile Street, Sohag, Asyut",Current us become clearly we candidate bill.,75,12,245,205,Egypt,Sohag,780-8387,380.0
206,Cross-Browser Compatibility Testing,"Conduct cross-browser compatibility testing to ensure website functionality and performance consistency across different web browsers such as Chrome, Firefox, Safari, and Edge",done,2021-01-29T05:48:21-09:03,2021-05-24T04:41:52-08:06,"49 Al Ahram Street, Ismailia, Ismailia",Good send plant public new admit.,88,31,449,206,Egypt,Ismailia,889-2482,550.0
207,International Shipping Solutions,Offer comprehensive international shipping solutions for businesses and individuals.,open,2020-04-15T19:02:29-02:08,2021-04-29T02:27:54-01:08,"20 Al Nahda Street, Banha, Qalyubia",Close indeed get growth radio media all.,82,7,738,207,Egypt,Banha,441-4155,460.0
208,Education Content Creation,"Develop engaging and informative educational content for online courses, tutorials, and learning resources",cancelled,2020-01-01T14:18:23-00:07,2020-11-23T19:03:04-08:05,"52 El Nasr Street, Akhmim, Sohag",Step its past. Before community administration.,98,82,641,208,Egypt,Akhmim,691-5909,980.0
209,Emergency Electrical Repairs,"Diagnose and repair faulty wiring, overloaded circuits, and electrical hazards promptly to restore power and ensure safety",cancelled,2024-05-16T01:22:52-09:05,2024-05-24T05:45:23-08:08,"27 Al Horreya Street, Abnub, Asyut",Necessary thought home.,88,12,413,209,Egypt,Abnub,871-2109,650.0
210,Landscape Design and Installation,"Provide ongoing maintenance services such as pruning, mulching, fertilizing, and seasonal cleanups to preserve the beauty and health of landscaped areas.",open,2021-12-09T16:40:29-05:07,2023-11-28T19:53:25-02:09,"88 October Street, Luxor, Luxor",White hope catch marriage.,61,14,149,210,Egypt,Luxor,740-0288,430.0
211,Blockchain Development Services,"Offer blockchain maintenance and support services, including node management, network monitoring, security audits, and protocol upgrades, to ensure the stability, performance, and resilience of blockchain ecosystems.",pending,2022-11-25T02:14:56-00:07,2020-04-27T03:32:10-09:05,"13 El Nozha Street, Nag Hammadi, Qena",Agree water key according reflect author price.,47,20,722,211,Egypt,Nag Hammadi,322-9332,185.0
212,SEO-Friendly Design Strategies,"Optimize on-page elements, metadata, site structure, and URL structures to enhance crawlability, indexability, and relevance for target keywords",open,2024-04-26T06:51:26-09:05,2024-05-27T05:07:58-04:08,"45 October Street, Ain Shams, Sharqia",Teach wear throw town energy.,57,31,110,212,Egypt,Ain Shams,996-6806,855.0
213,ESL/EFL Instruction,Provide English as a Second Language (ESL) or English as a Foreign Language (EFL) instruction to non-native speakers of English,cancelled,2023-10-26T10:20:53-03:03,2021-09-10T18:42:36-04:06,"95 Al Nile Street, Giza, Giza",Way response growth.,26,54,137,213,Egypt,Giza,286-9925,360.0
214,Motion Graphics Design,"Design dynamic motion graphics and visual effects for multimedia projects, including title sequences, logo animations, and promotional videos",done,2023-11-01T08:12:55-00:02,2024-05-14T13:36:27-05:01,"72 Gamal Abdel Nasser Street, Tamiya, Faiyum",Us treatment address address save.,99,58,889,214,Egypt,Tamiya,949-7888,595.0
215,Interactive Learning Modules,"Incorporate videos, animations, simulations, and interactive exercises to create immersive learning experiences",done,2021-02-09T05:49:53-02:09,2024-04-24T01:42:35-03:08,"92 Al-Azhar Street, Shubra El-Kheima, Cairo",Ball left piece stop strategy always.,2,82,591,215,Egypt,Shubra El-Kheima,565-1378,965.0
216,Electrical Troubleshooting Services,Provide professional recommendations and solutions for preventing future electrical problems and improving overall electrical efficiency.,open,2022-06-13T02:37:20-03:03,2021-08-23T00:06:45-07:01,"48 Al Ahram Street, Nag Hammadi, Qena",From mouth green people. Smile drive admit.,26,12,225,216,Egypt,Nag Hammadi,483-6579,995.0
